{
  "schemaVersion": 1,
  "decision": "DR-0083",
  "status": "FROZEN_TARGET_NOT_ACTIVE",
  "runtimeActivation": false,
  "reference": "Independent fixed-width writer; public test seeds e1/e2 repeated 32 times; not production authority",
  "positiveCases": [
    {
      "id": "deposit-empty",
      "domain": 1,
      "generation": 1,
      "recordHex": "4d47523100010201000c00000001000000000010111111111111111111111111111111110002000000000026504d413200012222222222222222222222222222222222222222222222222222222222222222000300000000000101000400000000002025fc32c478a5a4f84e4557a0342e08278c883641b6149bdb0b4a986ab6c2cb780005000000000008000000000000000100060000000000200000000000000000000000000000000000000000000000000000000000000000000700000000000800000000000000be000800000000000800000000000000be000900000000000800000000000000e6000a00000000000400000000000b000000000000000c00000000004052921018606534d2e39dca329b6e61b06f757b447ee1a84becce33dcfd0c592ea54e69fd6ad455ff822e86d79f57c3580275679309400974bba7a4dd19085b01",
      "unsignedHex": "4d47523100010201000b00000001000000000010111111111111111111111111111111110002000000000026504d413200012222222222222222222222222222222222222222222222222222222222222222000300000000000101000400000000002025fc32c478a5a4f84e4557a0342e08278c883641b6149bdb0b4a986ab6c2cb780005000000000008000000000000000100060000000000200000000000000000000000000000000000000000000000000000000000000000000700000000000800000000000000be000800000000000800000000000000be000900000000000800000000000000e6000a00000000000400000000000b000000000000",
      "signatureInputHex": "446565702f58506f696e742f56312f4d4752312f697373756572000201000000ff4d47523100010201000b00000001000000000010111111111111111111111111111111110002000000000026504d413200012222222222222222222222222222222222222222222222222222222222222222000300000000000101000400000000002025fc32c478a5a4f84e4557a0342e08278c883641b6149bdb0b4a986ab6c2cb780005000000000008000000000000000100060000000000200000000000000000000000000000000000000000000000000000000000000000000700000000000800000000000000be000800000000000800000000000000be000900000000000800000000000000e6000a00000000000400000000000b000000000000",
      "coreHashHex": "7c07a2eec1776ed8bd9ec5869df88668811bc8c2d18e692b0d20a1c191a28211",
      "recordSha256": "c35d1d75613481a3660bbc5e5ab373241af694ba9bf775aedc9a93134af35cc1",
      "issuerPublicKeyHex": "25fc32c478a5a4f84e4557a0342e08278c883641b6149bdb0b4a986ab6c2cb78"
    },
    {
      "id": "retrieve-empty",
      "domain": 2,
      "generation": 1,
      "recordHex": "4d47523100010201000c00000001000000000010111111111111111111111111111111110002000000000026504d4132000122222222222222222222222222222222222222222222222222222222222222220003000000000001020004000000000020c91cb3ce2b84e4ba85f562ece41edfe4e27afc52d88d507f66a18638df823e9f0005000000000008000000000000000100060000000000200000000000000000000000000000000000000000000000000000000000000000000700000000000800000000000000be000800000000000800000000000000be000900000000000800000000000000e6000a00000000000400000000000b000000000000000c00000000004042d4673d53c2840b6d6707bd309227d09abdbb01df6b695d091845200fb47ce4884cfff3ef86064708fd2011774596e7f797bf6aafdaf2078c5407bfecf41404",
      "unsignedHex": "4d47523100010201000b00000001000000000010111111111111111111111111111111110002000000000026504d4132000122222222222222222222222222222222222222222222222222222222222222220003000000000001020004000000000020c91cb3ce2b84e4ba85f562ece41edfe4e27afc52d88d507f66a18638df823e9f0005000000000008000000000000000100060000000000200000000000000000000000000000000000000000000000000000000000000000000700000000000800000000000000be000800000000000800000000000000be000900000000000800000000000000e6000a00000000000400000000000b000000000000",
      "signatureInputHex": "446565702f58506f696e742f56312f4d4752312f697373756572000201000000ff4d47523100010201000b00000001000000000010111111111111111111111111111111110002000000000026504d4132000122222222222222222222222222222222222222222222222222222222222222220003000000000001020004000000000020c91cb3ce2b84e4ba85f562ece41edfe4e27afc52d88d507f66a18638df823e9f0005000000000008000000000000000100060000000000200000000000000000000000000000000000000000000000000000000000000000000700000000000800000000000000be000800000000000800000000000000be000900000000000800000000000000e6000a00000000000400000000000b000000000000",
      "coreHashHex": "b680168d37b71bebf63e5adf31853725a730a4fcb1425873dd582a082fa1a7a4",
      "recordSha256": "95497dee57ecdefe05dfccaf7241d4da8d2e8a44e61e2eb1d0420986467d9e76",
      "issuerPublicKeyHex": "c91cb3ce2b84e4ba85f562ece41edfe4e27afc52d88d507f66a18638df823e9f"
    },
    {
      "id": "deposit-revoked",
      "domain": 1,
      "generation": 1,
      "recordHex": "4d47523100010201000c00000001000000000010111111111111111111111111111111110002000000000026504d413200012222222222222222222222222222222222222222222222222222222222222222000300000000000101000400000000002025fc32c478a5a4f84e4557a0342e08278c883641b6149bdb0b4a986ab6c2cb780005000000000008000000000000000100060000000000200000000000000000000000000000000000000000000000000000000000000000000700000000000800000000000000be000800000000000800000000000000be000900000000000800000000000000e6000a00000000000400000001000b00000000001051515151515151515151515151515151000c00000000004000a9bc340772b32dc894d26d1786cfbf36a3b258135e87c26520131d8cf5191ed549e7de481dbadb8aef272fdf56b6063eb81e3ca54a9eac3388486e103f3800",
      "unsignedHex": "4d47523100010201000b00000001000000000010111111111111111111111111111111110002000000000026504d413200012222222222222222222222222222222222222222222222222222222222222222000300000000000101000400000000002025fc32c478a5a4f84e4557a0342e08278c883641b6149bdb0b4a986ab6c2cb780005000000000008000000000000000100060000000000200000000000000000000000000000000000000000000000000000000000000000000700000000000800000000000000be000800000000000800000000000000be000900000000000800000000000000e6000a00000000000400000001000b00000000001051515151515151515151515151515151",
      "signatureInputHex": "446565702f58506f696e742f56312f4d4752312f6973737565720002010000010f4d47523100010201000b00000001000000000010111111111111111111111111111111110002000000000026504d413200012222222222222222222222222222222222222222222222222222222222222222000300000000000101000400000000002025fc32c478a5a4f84e4557a0342e08278c883641b6149bdb0b4a986ab6c2cb780005000000000008000000000000000100060000000000200000000000000000000000000000000000000000000000000000000000000000000700000000000800000000000000be000800000000000800000000000000be000900000000000800000000000000e6000a00000000000400000001000b00000000001051515151515151515151515151515151",
      "coreHashHex": "1f9a9c6a22d3b822c6e6e5466d93dc7e8c18861f44f9f5b6e812801e9f4e55ed",
      "recordSha256": "5558ecd052adc5e16439624622cee1dda9869472a697264731b0721bfd6aea0a",
      "issuerPublicKeyHex": "25fc32c478a5a4f84e4557a0342e08278c883641b6149bdb0b4a986ab6c2cb78"
    },
    {
      "id": "deposit-successor",
      "domain": 1,
      "generation": 2,
      "recordHex": "4d47523100010201000c00000001000000000010111111111111111111111111111111110002000000000026504d413200012222222222222222222222222222222222222222222222222222222222222222000300000000000101000400000000002025fc32c478a5a4f84e4557a0342e08278c883641b6149bdb0b4a986ab6c2cb780005000000000008000000000000000200060000000000201f9a9c6a22d3b822c6e6e5466d93dc7e8c18861f44f9f5b6e812801e9f4e55ed000700000000000800000000000000c3000800000000000800000000000000c3000900000000000800000000000000e6000a00000000000400000002000b0000000000205151515151515151515151515151515152525252525252525252525252525252000c0000000000404bd940e56ed845b263cb264af6854f10a27ab33c1f78a684c3d44d80c9097835fd9702ac89c669c19ba49b128cd572b198fff8002ebbbb6567aca6444ce3b404",
      "unsignedHex": "4d47523100010201000b00000001000000000010111111111111111111111111111111110002000000000026504d413200012222222222222222222222222222222222222222222222222222222222222222000300000000000101000400000000002025fc32c478a5a4f84e4557a0342e08278c883641b6149bdb0b4a986ab6c2cb780005000000000008000000000000000200060000000000201f9a9c6a22d3b822c6e6e5466d93dc7e8c18861f44f9f5b6e812801e9f4e55ed000700000000000800000000000000c3000800000000000800000000000000c3000900000000000800000000000000e6000a00000000000400000002000b0000000000205151515151515151515151515151515152525252525252525252525252525252",
      "signatureInputHex": "446565702f58506f696e742f56312f4d4752312f6973737565720002010000011f4d47523100010201000b00000001000000000010111111111111111111111111111111110002000000000026504d413200012222222222222222222222222222222222222222222222222222222222222222000300000000000101000400000000002025fc32c478a5a4f84e4557a0342e08278c883641b6149bdb0b4a986ab6c2cb780005000000000008000000000000000200060000000000201f9a9c6a22d3b822c6e6e5466d93dc7e8c18861f44f9f5b6e812801e9f4e55ed000700000000000800000000000000c3000800000000000800000000000000c3000900000000000800000000000000e6000a00000000000400000002000b0000000000205151515151515151515151515151515152525252525252525252525252525252",
      "coreHashHex": "4217cf0b72c5b99c387a48c678a2cc3fea73e332ef332a7c922245f5570b5753",
      "recordSha256": "4f5e5469c5f7d2a39aee81533b1ac3664c3c60d5576b08a44c26d66903fad07e",
      "issuerPublicKeyHex": "25fc32c478a5a4f84e4557a0342e08278c883641b6149bdb0b4a986ab6c2cb78"
    }
  ],
  "negativeCases": [
    {
      "id": "version",
      "recordHex": "4d47523100020201000c00000001000000000010111111111111111111111111111111110002000000000026504d413200012222222222222222222222222222222222222222222222222222222222222222000300000000000101000400000000002025fc32c478a5a4f84e4557a0342e08278c883641b6149bdb0b4a986ab6c2cb780005000000000008000000000000000100060000000000200000000000000000000000000000000000000000000000000000000000000000000700000000000800000000000000be000800000000000800000000000000be000900000000000800000000000000e6000a00000000000400000000000b000000000000000c00000000004052921018606534d2e39dca329b6e61b06f757b447ee1a84becce33dcfd0c592ea54e69fd6ad455ff822e86d79f57c3580275679309400974bba7a4dd19085b01",